{
  "schemaVersion": "trading_research.agent_portfolio.v1",
  "generatedAt": "2026-08-28T22:00:00Z",
  "asOf": "2026-08-28",
  "agent": {
    "id": "glm-daily",
    "provider": "seed",
    "model": "paper-seed",
    "promptVersion": "agent-paper-v1",
    "inputHash": "aaaaaaaaaaaaaaaaaaaaaaaaaaaaaaaaaaaaaaaaaaaaaaaaaaaaaaaaaaaaaaaa"
  },
  "portfolio": {
    "initialEquity": 100000,
    "equity": 100000,
    "cash": 100000,
    "nav": 1,
    "totalReturn": 0,
    "maxDrawdown": 0
  },
  "metrics": {"totalReturn": 0, "maxDrawdown": 0},
  "decision": {"targetWeights": {"CASH": 1}, "reasoningSummary": "当前样例保持现金，仅用于展示页面结构。"},
  "positions": [],
  "trades": [],
  "history": [
    {"asOf": "2026-08-28", "equity": 100000, "nav": 1, "drawdown": 0}
  ]
}
